1. !!!!!!!!!!!!!!!!! 

mysql> select * from users;
+----+--------+---------------------+---------------------+------+------------+------------+
| id | name   | date                | birthday            | room | created_at | updated_at |
+----+--------+---------------------+---------------------+------+------------+------------+
| 11 | oleg   | 2020-03-24 17:24:36 | 2020-04-04 17:27:21 |    2 | NULL       | NULL       |
| 12 | misha  | 2020-03-24 17:38:32 | 2019-04-04 17:27:21 |    2 | NULL       | NULL       |
| 13 | NULL   | 2020-04-04 08:18:00 | 2020-04-04 17:27:21 |    1 | NULL       | NULL       |
| 14 | andrei | 2020-04-04 17:07:55 | 2018-04-04 17:27:21 |    1 | NULL       | NULL       |
+----+--------+---------------------+---------------------+------+------------+------------+
4 rows in set (0,00 sec)


mysql> update users set created_at = NOW();
Query OK, 4 rows affected (0,00 sec)
Rows matched: 4  Changed: 4  Warnings: 0

mysql> update users set updated_at = NOW();
Query OK, 4 rows affected (0,02 sec)
Rows matched: 4  Changed: 4  Warnings: 0

mysql> select * from users;
+----+--------+---------------------+---------------------+------+---------------------+---------------------+
| id | name   | date                | birthday            | room | created_at          | updated_at          |
+----+--------+---------------------+---------------------+------+---------------------+---------------------+
| 11 | oleg   | 2020-03-24 17:24:36 | 2020-04-04 17:27:21 |    2 | 2020-04-04 19:42:06 | 2020-04-04 19:42:12 |
| 12 | misha  | 2020-03-24 17:38:32 | 2019-04-04 17:27:21 |    2 | 2020-04-04 19:42:06 | 2020-04-04 19:42:12 |
| 13 | NULL   | 2020-04-04 08:18:00 | 2020-04-04 17:27:21 |    1 | 2020-04-04 19:42:06 | 2020-04-04 19:42:12 |
| 14 | andrei | 2020-04-04 17:07:55 | 2018-04-04 17:27:21 |    1 | 2020-04-04 19:42:06 | 2020-04-04 19:42:12 |
+----+--------+---------------------+---------------------+------+---------------------+---------------------+
4 rows in set (0,00 sec)

mysql> 

2. !!!!!!!!!!!!!!!!!!!!!!!!!!!!!!!!!!!!!

mysql> describe  users;
+------------+--------------+------+-----+-------------------+-------------------+
| Field      | Type         | Null | Key | Default           | Extra             |
+------------+--------------+------+-----+-------------------+-------------------+
| id         | int          | NO   | PRI | NULL              |                   |
| name       | varchar(255) | YES  |     | NULL              |                   |
| date       | datetime     | YES  |     | CURRENT_TIMESTAMP | DEFAULT_GENERATED |
| birthday   | datetime     | YES  |     | NULL              |                   |
| room       | int          | YES  |     | NULL              |                   |
| created_at | varchar(255) | YES  |     | NULL              |                   |
| updated_at | varchar(255) | YES  |     | NULL              |                   |
+------------+--------------+------+-----+-------------------+-------------------+
7 rows in set (0,01 sec)

mysql> alter table users modify column updated_at DATETIME;
Query OK, 4 rows affected (0,05 sec)
Records: 4  Duplicates: 0  Warnings: 0

mysql> alter table users modify column created_at DATETIME;
Query OK, 4 rows affected (0,06 sec)
Records: 4  Duplicates: 0  Warnings: 0

mysql> describe  users;
+------------+--------------+------+-----+-------------------+-------------------+
| Field      | Type         | Null | Key | Default           | Extra             |
+------------+--------------+------+-----+-------------------+-------------------+
| id         | int          | NO   | PRI | NULL              |                   |
| name       | varchar(255) | YES  |     | NULL              |                   |
| date       | datetime     | YES  |     | CURRENT_TIMESTAMP | DEFAULT_GENERATED |
| birthday   | datetime     | YES  |     | NULL              |                   |
| room       | int          | YES  |     | NULL              |                   |
| created_at | datetime     | YES  |     | NULL              |                   |
| updated_at | datetime     | YES  |     | NULL              |                   |
+------------+--------------+------+-----+-------------------+-------------------+
7 rows in set (0,00 sec)

mysql> select * from users;
+----+--------+---------------------+---------------------+------+---------------------+---------------------+
| id | name   | date                | birthday            | room | created_at          | updated_at          |
+----+--------+---------------------+---------------------+------+---------------------+---------------------+
| 11 | oleg   | 2020-03-24 17:24:36 | 2020-04-04 17:27:21 |    2 | 2020-04-04 19:42:06 | 2020-04-04 19:42:12 |
| 12 | misha  | 2020-03-24 17:38:32 | 2019-04-04 17:27:21 |    2 | 2020-04-04 19:42:06 | 2020-04-04 19:42:12 |
| 13 | NULL   | 2020-04-04 08:18:00 | 2020-04-04 17:27:21 |    1 | 2020-04-04 19:42:06 | 2020-04-04 19:42:12 |
| 14 | andrei | 2020-04-04 17:07:55 | 2018-04-04 17:27:21 |    1 | 2020-04-04 19:42:06 | 2020-04-04 19:42:12 |
+----+--------+---------------------+---------------------+------+---------------------+---------------------+
4 rows in set (0,00 sec)

mysql> 

3. !!!!!!!!!!!!!!!!!!!!!!!!!!!!!!!!!!!


mysql> select * from storehouses_products;                                          +----+--------+-------+
| id | name   | value |
+----+--------+-------+
|  1 | tovar1 |     1 |
|  2 | tovar2 |     0 |
|  3 | tovar3 |    50 |
|  4 | tovar4 |     0 |
|  5 | tovar5 |  2500 |
+----+--------+-------+
5 rows in set (0,00 sec)

mysql> select value from storehouses_products order by CASE when value = 0 THEN '99' END;
+-------+
| value |
+-------+
|     1 |
|    50 |
|  2500 |
|     0 |
|     0 |
+-------+
5 rows in set (0,00 sec)

mysql> 

mysql> select value from storehouses_products where value != 0 union all select value from storehouses_products where value = 0;
+-------+
| value |
+-------+
|     1 |
|    50 |
|  2500 |
|     0 |
|     0 |
+-------+
5 rows in set (0,00 sec)

mysql> 

4. !!!!!!!!!!!!!!!!!!!!!!!

mysql> select * from users where substring(birthday, 6, 7) = 05 OR substring(birthday, 6, 7) = 06;
+----+--------+---------------------+---------------------+------+---------------------+---------------------+
| id | name   | date                | birthday            | room | created_at          | updated_at          |
+----+--------+---------------------+---------------------+------+---------------------+---------------------+
| 15 | kostya | 2020-04-05 18:19:34 | 2000-05-03 16:25:00 |    1 | 2020-04-05 18:19:34 | 2020-04-05 18:19:34 |
| 16 | max    | 2020-04-05 18:20:08 | 2000-06-15 10:25:00 |    1 | 2020-04-05 18:20:08 | 2020-04-05 18:20:08 |
+----+--------+---------------------+---------------------+------+---------------------+---------------------+
2 rows in set (0,00 sec)

mysql> 

5. !!!!!!!!!!!!!!!!!!!!!!!!

mysql> select * from proizv where id in (5,1,2);
+----+
| id |
+----+
|  1 |
|  2 |
|  5 |
+----+
3 rows in set (0,00 sec)

mysql> select * from proizv where id in (5,1,2) ORDER BY CASE
    -> WHEN id = 5 THEN '1'
    -> WHEN id = 1 THEN '2'
    -> WHEN id = 2 THEN '3'
    -> END;
+----+
| id |
+----+
|  5 |
|  1 |
|  2 |
+----+
3 rows in set (0,00 sec)

mysql> 


----------------------------------------------------------

1.!!!!!!!!!!!!!!!!!!

mysql> select * from users;
+----+--------+---------------------+---------------------+------+---------------------+---------------------+
| id | name   | date                | birthday            | room | created_at          | updated_at          |
+----+--------+---------------------+---------------------+------+---------------------+---------------------+
| 11 | oleg   | 2020-03-24 17:24:36 | 2020-04-04 17:27:21 |    2 | 2020-04-04 19:42:06 | 2020-04-04 19:42:12 |
| 12 | misha  | 2020-03-24 17:38:32 | 2019-04-04 17:27:21 |    2 | 2020-04-04 19:42:06 | 2020-04-04 19:42:12 |
| 13 | NULL   | 2020-04-04 08:18:00 | 2020-04-04 17:27:21 |    1 | 2020-04-04 19:42:06 | 2020-04-04 19:42:12 |
| 14 | andrei | 2020-04-04 17:07:55 | 2018-04-04 17:27:21 |    1 | 2020-04-04 19:42:06 | 2020-04-04 19:42:12 |
+----+--------+---------------------+---------------------+------+---------------------+---------------------+
4 rows in set (0,00 sec)

mysql> 
mysql> 
mysql> 
mysql> select name, timestampdiff(year, birthday, NOW()) as age from users;
+--------+------+
| name   | age  |
+--------+------+
| oleg   |    0 |
| misha  |    1 |
| NULL   |    0 |
| andrei |    2 |
+--------+------+
4 rows in set (0,00 sec)

mysql> select avg(timestampdiff(year, birthday, NOW())) as age from users;
+--------+
| age    |
+--------+
| 0.7500 |
+--------+
1 row in set (0,00 sec)

mysql> 

2. !!!!!!!!!!!!!!!!!!!!!!!!!!!!!!!!

mysql> select * from users;                                                         +----+--------+---------------------+---------------------+------+---------------------+---------------------+
| id | name   | date                | birthday            | room | created_at          | updated_at          |
+----+--------+---------------------+---------------------+------+---------------------+---------------------+
| 11 | oleg   | 2020-03-24 17:24:36 | 2020-04-04 17:27:21 |    2 | 2020-04-04 19:42:06 | 2020-04-04 19:42:12 |
| 12 | misha  | 2020-03-24 17:38:32 | 2019-04-04 17:27:21 |    2 | 2020-04-04 19:42:06 | 2020-04-04 19:42:12 |
| 13 | NULL   | 2020-04-04 08:18:00 | 2020-04-04 17:27:21 |    1 | 2020-04-04 19:42:06 | 2020-04-04 19:42:12 |
| 14 | andrei | 2020-04-04 17:07:55 | 2018-04-04 17:27:21 |    1 | 2020-04-04 19:42:06 | 2020-04-04 19:42:12 |
+----+--------+---------------------+---------------------+------+---------------------+---------------------+
4 rows in set (0,00 sec)

mysql> select count(*), dayname(birthday) as day from users group by day;
+----------+-----------+
| count(*) | day       |
+----------+-----------+
|        2 | Saturday  |
|        1 | Thursday  |
|        1 | Wednesday |
+----------+-----------+
3 rows in set (0,00 sec)

mysql> 


3 !!!!!!!!!!!!!!!!!!!!!!!!!!!!!!!!!!!

mysql> select * from proizv;
+----+
| id |
+----+
|  1 |
|  2 |
|  3 |
|  4 |
|  5 |
+----+
5 rows in set (0,00 sec)

mysql> SELECT round(exp(SUM(log(id))), 0) FROM proizv;
+-----------------------------+
| round(exp(SUM(log(id))), 0) |
+-----------------------------+
|                         120 |
+-----------------------------+
1 row in set (0,00 sec)

mysql> 

